{
  "$schema": "./schemas/dependencies-schema.json",
  "version": "1.0.0",
  "generated_at": "2024-01-15T10:00:00Z",

  "package_manager": "npm",
  "lockfile": "package-lock.json",

  "production": {
    "framework": [
      { "name": "next", "version": "14.0.4", "purpose": "React framework" },
      { "name": "react", "version": "18.2.0", "purpose": "UI library" },
      { "name": "react-dom", "version": "18.2.0", "purpose": "React DOM" }
    ],
    "state_management": [
      { "name": "zustand", "version": "4.4.7", "purpose": "State management" },
      { "name": "@tanstack/react-query", "version": "5.17.0", "purpose": "Server state" }
    ],
    "styling": [
      { "name": "tailwindcss", "version": "3.4.0", "purpose": "Utility CSS" },
      { "name": "clsx", "version": "2.1.0", "purpose": "Class merging" }
    ],
    "database": [
      { "name": "@prisma/client", "version": "5.8.0", "purpose": "Database client" }
    ],
    "authentication": [
      { "name": "next-auth", "version": "4.24.5", "purpose": "Authentication" }
    ],
    "validation": [
      { "name": "zod", "version": "3.22.4", "purpose": "Schema validation" }
    ],
    "utilities": [
      { "name": "date-fns", "version": "3.2.0", "purpose": "Date utilities" },
      { "name": "lodash-es", "version": "4.17.21", "purpose": "Utility functions" }
    ]
  },

  "development": {
    "typescript": [
      { "name": "typescript", "version": "5.3.3" },
      { "name": "@types/react", "version": "18.2.47" },
      { "name": "@types/node", "version": "20.10.6" }
    ],
    "testing": [
      { "name": "vitest", "version": "1.2.0", "purpose": "Test framework" },
      { "name": "@testing-library/react", "version": "14.1.2" },
      { "name": "playwright", "version": "1.40.1", "purpose": "E2E testing" }
    ],
    "linting": [
      { "name": "eslint", "version": "8.56.0" },
      { "name": "prettier", "version": "3.2.2" }
    ],
    "database": [
      { "name": "prisma", "version": "5.8.0", "purpose": "Database toolkit" }
    ]
  },

  "internal_dependencies": {
    "src/components": {
      "imports_from": ["src/hooks", "src/types", "src/utils"],
      "imported_by": ["src/app"]
    },
    "src/hooks": {
      "imports_from": ["src/services", "src/stores", "src/types"],
      "imported_by": ["src/components", "src/app"]
    },
    "src/services": {
      "imports_from": ["src/types", "src/utils"],
      "imported_by": ["src/hooks"]
    }
  },

  "circular_dependencies": [],

  "security": {
    "last_audit": "2024-01-15T10:00:00Z",
    "vulnerabilities": {
      "critical": 0,
      "high": 0,
      "medium": 1,
      "low": 2
    },
    "outdated_packages": 3
  }
}
